FilmId,Title,Rating,Year,Duration,Countries,Genres,ShortDescription,Director,Actors
46225,Бриллиантовая рука,8.5,1968,94,СССР,"криминал, комедия",Контрабандисты гоняются за примерным семьянином. Народная комедия с элементами абсурда от Леонида Гайдая ,Леонид Гайдай,"Юрий Никулин, Андрей Миронов, Анатолий Папанов, Нина Гребешкова, Станислав Чекан, Владимир Гуляев, Нонна Мордюкова, Светлана Светличная, Роман Филиппов, Григорий Шпигель, Леонид Каневский, Игорь Ясулович, Максим Никулин, Александра Лисютина, Александр Хвыля, Андрей Файт, Герман Качин, Евгения Мельникова, Татьяна Никулина, Виктория Островская, Георгий Светлани, Николай Трофимов, Виктор Уральский, Аполлон Ячницкий, Иван Жеваго, Леонид Плешаков, Николай Романов, Дмитрий Николаев, Игорь Василенко, Константин Мазанов, Серафима Холина, Лев Поляков, Леонид Гайдай, Рафаэль Котанджян, Александр Козубский, Вадим Витвицкий"
195334,Престиж,8.5,2006,125,"США, Великобритания","триллер, драма, детектив, фантастика",Вражда двух иллюзионистов выходит на новый уровень. Фильм Кристофера Нолана с Дэвидом Боуи в роли Николы Теслы,Кристофер Нолан,"Хью Джекман, Кристиан Бэйл, Майкл Кейн, Пайпер Перабо, Ребекка Холл, Скарлетт Йоханссон, Саманта Мэхурин, Дэвид Боуи, Энди Серкис, Дэниэл Дэвис, Джим Пиддок, Кристофер Ним, Марк Райан, Роджер Рис, Джэми Харрис, Монти Стюарт, Рон Перкинс, Рики Джей, Дж. Пол Мур, Энтони Де Марко, Чао Ли Чи, Грегори Хэмпфри, Джон Б. Край, Уильям Морган Шеппард, Шон Хоус, Джули Санфорд, Эзра Баззингтон, Джеймс Ланкастер, Оливия Мерг, Зои Мерг, Джонни Лиска, Расс Фега, Кевин Уилл, Эдвард Хибберт, Кристофер Джаджес, Джеймс Отис, Сэм Меннинг, Брайан Тахэш, Скотт Дэвис, Джоди Бьянка Уайз, Никки Глик, Енн Рейтел, Клайв Кеннеди, Роб Арбогаст, Крис Кливлэнд, , , Бейзил МакКарри, Марти Кэрролл, Эрин Чиполетти, , Эрни Хайнц, Тим Пиллери, Венди Рософф, Гари Зиверс, Инна Сванн, Доун Апшоу, Дианна Линн, Джесси Вильде"
444,Терминатор 2: Судный день,8.3,1991,137,США,"триллер, фантастика, боевик",Роботы из будущего воюют за спасителя человечества. Культовое кино от Джеймса Кэмерона,Джеймс Кэмерон,"Арнольд Шварценеггер, Линда Хэмилтон, Эдвард Ферлонг, Роберт Патрик, Эрл Боэн, Джо Мортон, С. Ипейта Меркерсон, Кастуло Герра, Дэнни Кукси, Дженетт Голдстин, Ксандер Беркли, Лесли Хэмилтон Геррен, Кен Гиббел, Роберт Уинли, Питер Шрум, Шэйн Уайлдер, Майкл Эдвардс, Джаред Лоунсбери, Кэйси Чавез, Энналлс Берл, Дон Лейк, Ричард Видан, Том МакДональд, Джим Палмер, Джерард Дж. Уильямс, Гвенда Дикон, Дон Стэнтон, Дэн Стэнтон, Колин Патрик Линч, Ноэл Эвангелисти, Никки Кокс, Лиза Бринегар, Девон Никсон, Тони Саймотс, Дайан Родригес, Далтон Эбботт, Рон Янг, Чарльз Роберт Браун, Абдул Салаам Эль Раззас, Майк Мускат, Дин Норрис, Чарльз А. Тамбурро, Дж. Роб Джордан, Терренс Эванс, Денни Пирс, Марк Кристофер Лоуренс, Пэт Коури, Ван Линг, Майкл Альбанезе, Эд Арнесон, Брэт А. Арнольд, Дин Бланк, Дебра Кэйси, Джим Даль, Мартин Делюка, , , Такао Комине, Джоэль Крамер, Энн Меррем, Мик Роджерс, , Скотт Шоу, Стивен Стеар, Свен-Оле Торсен, Рэнди Уокер, Уильям Уишер мл."
63912,Укрощение строптивого,8.4,1980,107,Италия,"мелодрама, комедия",Красавица Лиза перевоспитывает заядлого холостяка. Шекспировские страсти с Адриано Челентано и Орнеллой Мути,Джузеппе Моччиа,"Адриано Челентано, Орнелла Мути, Эдит Питерс, Пиппо Сантонастасо, Милли Карлуччи, Сандро Гиани, Николя Дель Буоно, Энцо Де Тома, Винченцо Де Тома, Джимми иль Феномено, Елена Мари, , Гвидо Спадеа, Марко Колумбро, Джанна Колетти, Массимо Мирани, Виктор Полетти, Джузеппе Сантобуоно, Луиджи Ува, Луиджи Пелитти, Джанни Франко, Роберто Жарди, Маурицио Фардо, Франческо Папи, Лучиано Фино, Паоло Тарквини, Винченцо Триподи, Флора Кароселло, Массимо Бушеми"
775276,Зверополис,8.3,2016,108,США,"криминал, детектив, приключения, комедия, мультфильм, семейный",Отважная крольчиха делает карьеру в полиции звериного города. Оскароносная комедия с серьезным подтекстом,Джаред Буш,"Джиннифер Гудвин, Джейсон Бейтман, Идрис Эльба, Дженни Слейт, Нейт Торренс, Бонни Хант, Дон Лейк, Томми Чонг, Дж.К. Симмонс, Октавия Спенсер, Алан Тьюдик, Шакира, Рэймонд С. Перси, Делла Саба, Морис ЛаМарш, Фил Джонстон, Фуския, Джон Ди Маджио, Кэти Лоус, Гита Редди, Джесси Корти, Том ’Тайни’ Листер мл., Джошуа Даллас, Леа Лэтэм, Рич Мур, Кэт Суси, Питер Мэнсбридж, Байрон Ховард, Джаред Буш, Марк Смит, Джози Тринидад, Джон Лэвэлл, Кристен Белл, Эвелин Уилсон Бреси, Хьюит Буш, Джилл Кордес, Мадлен Карри, Терри Дуглас, Мелисса Гудвин Шеперд, Зак Кинг, Дэйв Когут, Джереми Милтон, Паке Полсен, Фабьен Роули, Брэд Симонсен, Клер К. Смит, Джексон Штайн, Дэвид А. Тибодо, Джон Уилер, Ханна Дж. Уильямс, Николас Гест, "
4541,Шоу Трумана,8.3,1998,103,США,"драма, комедия","Благополучный страховой агент обнаруживает, что он — герой реалити-шоу. Джим Керри в пророческой антиутопии",Питер Уир,"Джим Керри, Лора Линни, Ноа Эммерих, Наташа МакЭлхоун, Эд Харрис, Холланд Тейлор, Брайан Дилейт, Пол Джаматти, Гарри Ширер, Филип Бейкер Холл, Блэр Слэйтер, Питер Краузе, Хайди Шанц, Рон Тейлор, Дон Тейлор, Тед Рэймонд, Джуди Клэйтон, Фриц Доминик, Энджел Шмидт, Настасия Шмийдт, Мюриэль Мур, Мэл Джонс, Джадсон Вон, Эрл Хиллиард мл., Дэвид Эндрю Нэш, Джим Тауэрс, Саванна Своффорд, Энтони Короне, Марио Эрнесто Санчес, Джон Роселиус, Кэйд Коутс, Марсия ДеБонис, Сэм Китчин, Себастьян Янблад, Дэйв Кори, Марк Алан Гиллотт, Джей Сейтер, Тони Тодд, Марко Рубео, Дэррил Дэвис, Роберт Дэвис, Р.Дж. Мёрдок, Мэттью МакДонаф, Ларри Макдауэлл, Джозеф Лукус, Логан Киркси, Адам Томей, Уна Дэймон, Джон Плешетт, Филип Гласс, Джон Прамик, О-Лан Джонс, Криста Линн Лэндолфи, Джо Миньярес, Аль Фостер, Зуанн Лерой, Милли Слэвин, Терри Камиллери, Донна Харди, Жанетт Миллер, Джоэль Маккиннон Миллер, Том Симмонс, Сьюзэн Анджело, Карли Смига, Юдзи Окумото, Киёко Ямагути, Саэми Накамура, Джэйк Эберли, Мелисса Фицджералд, Сержиу Като, Марк Маколей, Майкл Дж. МакАлистер, Микалин МакКормик, Арнольд Монти, Лорин Мур, Кортни Пакиз, Кевин Д. Росс, Джозеф Рай, Эрика Тейлор, Джен Тейлор, А. Маршал Уорд"
437410,Темный рыцарь: Возрождение легенды,8.2,2012,165,"США, Великобритания","триллер, драма, криминал, фантастика, боевик",Анархист в маске грозит взорвать Готэм и уничтожить Бэтмена. Грандиозный финал трилогии Кристофера Нолана,Кристофер Нолан,"Кристиан Бэйл, Том Харди, Энн Хэтэуэй, Джозеф Гордон-Левитт, Марион Котийяр, Гари Олдман, Морган Фриман, Майкл Кейн, Мэттью Модайн, Бен Мендельсон, Дэниел Сунджата, Эйдан Гиллен, Лиам Нисон, Алон Абутбул, Берн Горман, Нестор Карбонелл, Джуно Темпл, Брент Бриско, Регги Ли, Крис Эллис, Киллиан Мёрфи, Том Конти, Десмонд Хэррингтон, Бретт Каллен, Джош Стюарт, Сэм Кеннард, Элиаш Тепина, Ник Джулиан, Миранда Нолан, Клер Элис Жюльен, Джозеф Лайл Тейлор, Тайлер Флорес, Дуан Генри, Джеймс Уорд, Гонсало Менендес, Камерон Джек, Лекс Дэниэл, Томас Леннон, Тревор Уайт, Роб Браун, Фредрик Лене, Кортни Манч, Крис Хилл, Трэвис Губа, Джей Бенедикт, Уилл Эстес, Дэвид Дайан Фишер, Филлип Джеймс Гриффит, Глен Пауэлл, Бен Корниш, Расс Фега, Андрес Перес-Молина, Джон Нолан, Оливер Коттон, Марк Киллин, Сара Голдберг, Джон Макмиллан, Роберт Уиздом, Ронни Джин Блевинс, Джон Холлинворт, Иэн Боэн, Ури Гавриел, Ноэль Гульеми, Макс Шулер, Даина Гриффит, Эктор Атрею Руис, Патрик Кокс, Арамис Найт, Уильям Дивэйн, Гарри Коулз, Джои Кинг, Джули Мун, Дэвид Гяси, Патрик Джордан, Джошуа Риз, Михаэль Бейтс, Рори Нолан, Томас Арана, Питер  Эсли Холден, Дэвид Монахэн, Джиллиан Арменанте, Аджа Эванс, Алдоус Дэвидсон, Майкл Джеймс Фаради, Уэйд Уильямс, Энтуан Льюис, Джейк Канусо, Джошуа Пенс, Индия Вэдсворт, Кевин Кили, Дэниэл Ньюман, Масси Фурлан, Уоррен Браун, Люк Рутерфорд, Филлип Браун, Кристофер Джадж, Альдо Биганте, Чарльз Джексон Койн, Патрик Лихи, Тодд Джирхарт, Марк Аббинк, Джозеф М. Эбботт, , , Люсия М. Агирр, Тони Аламеда, Крис Олбрайт, Чарли Алехандро, Брэндон Аллентофф, Тони Амен, , Роберт Аренсен, , Диедра Артур О’Ри, Джеймс Авис, Грант Баббитт, Филеена Барис, Дженнифер Николь Бэйкер, , Дэвид Нэти Барнс, Блэр Барнетт, Джозеф Басиле, Томми Байиокос, , Камерон Белл, Тиффани Белл, Бен Берковитц, Грег Бевилль, Ник Бишоп, Брэндон Блэкуэлл, Джеймс Бланкенфелд, Тодд Блад, Тодд Бобенрит, Райан С. Боджвик, , Рик Боландер, Брендан Бойс, Кайл Патрик Бреннан, Роджер Бреннер, , Кори Браун, Грэхэм Браун, Ральф Браунинг, Стар Баннер, , Стивен Бутрос, Тимоти Баттс, Джулиан Камачо, Норман Кардаро, , Сэмюэл Каруана, Джон Кэшин, Стэффорд Чевис, Дженнифер Перл Чилдерс, Лонелл Р. Чилдред, Энтони Чишолм, Скотт Черчсон, Мэтт Кипро, Райан Кларк, Карл Клемонс, Уилли Колон, Кеннет Кумбс, Дэниэл Р. Купер, Ханна Купер Дин, , Билл Коуер, Скот Креган, Рубен Дарио Крус II, Джоаккино Джим Куффаро, Кристофер Джеймс Каллен, Райан Культрера, , Грэм Керри, Майкл Дидрикссон, Стефани Домини, Джедидайя Дор, Джонатан Даунс, , Марвин Дюэркхольц, Крис Дайер, Аарон Экхарт, Дэйв Эдмондс, Р. Майкл Иган, Грей Эллис, , Лалэйн Фаби, Джон Фейркрест, Марк Фальво, Винсент Фарр, Энтони Фаррадж, Шон П. Фаррелл, Джон Фаррер, Джеймс Фарриор, Луис Фасанаро, Фрэнк Фата, Сьюзэн Фельдбуш, Джо Фишел, Люк Оскар Форд, Теодор Джон Форси, Джастин Фортмайер, Мэттью Фрис, , Энтони Гарсиа, Лиза Гаррет, Гари Гиббс, Софи Джилберто, Грегори Джилласпи, , Кристофер Брайан, Хорхе Дж. Гонсалес, Мэттью Гули, , Рей Гойос, Майкл Гранд, Вито Грасси, Райан Грин, Сильвестр Грин, Майкл Рен Гуччиардо, Кевин Гурнари, , , Кэйси Хэмптон, Фрэнк Хансен, Сэм Харрис, Кэйн Л Харрисон, Грег Харт, Диого Хосен, Хелена Холмс, Эд Хиви, Уэйн Хеклер, Килльян Хайтауер, Пит Баззсоу Холлэнд, Лорен Хопкинс, Вера Хортон, Джон В. Иванонкив, Сонни Иззо, Кертис Жермен, , Эдгар Джимз, Стивен Т. Джонсон, Даниэль Джордано, Джейкоб Калафут, Джо Кэйн, Уильям Кания, , Тиффани Кемп, Билл Кеннеди, Дэвид Дастин Кенион, Андреа Керри, Ким, , Джесси Рейс, Хрвое Клеч, Шэрин Кмисиак, Закари Крессер, Илан Кригсфелд, Алекс Крус, , Ти Кунзелман, Тайлер Ла Марр, Шеннон Ланье, Джошуа Лассман, Роберт Лекингтон, Алонна Брайш, Брайан Ли, Гленн Дэвис Ли, Ле Джон, , Пол Джуд Летерски, Гас Льюис, , Сильвия Ломбардо, Джереми Лонг, Оскар Магана мл., , Джон Манчини, Макс Мангел, Грант Кристофер Маке, Дэн Маркус, Бренден Марлоу, Шон Мартин, Лондон Мэй, Фрэнк МакАливи, Майк Дж. МакАллистер, Орион МакКейб, Шон П. МакКарти, Кейл МакКоннелл, Дэвид Дэйл Маккью, Кайл МакГрат, Тиффани Сэндер Маккензи, Рэндолл Макнил, , Джон Мелолла, Аллен Мерритт, Хит Миллер, Джереми Мун, Алекс Мур, Пол Нандзик, , , Фил Нардоззи, Ниел Нельсон-Хопкинс, , Винсент ван Оммен, Алессандро Николачи, Адам Найт, Дарко Николич, Шейн Нолан, Дон Новацки, Джексон Нанн, Джозеф О’Брайэн, Шон О’Доннелл, , Майкл О’Нилл, , Майкл Пападжон, Дэнни Кларк, Стив Перри, , Адам Пьяченте, Эрнест Пирс, Кайл Дэвид Пирс, , , Дэвид Майкл Плауман, Трой Поламалу, Филлип М. Полайт, Моркис Поунси, Майкл Пауэр, Райан Преймесбергер, Джеймс Куинн, Дизел Рамос, Джейк Рамос, Люк Р. Рэйвенстал, Блейк Ридинг, , Саймон Ри, Джозеф Риттенхаус, Лайнас Роуч, , , Синдо Ки Родригез, Керстен Ретерс, Бен Ротлисбергер, Марк Роман, Эрл Рорер, Аарон Т. Радд, Тайлер Рамси, , Джо Руснак, , Энтони Дж Сакко, Эрик Салазар, Грег Саммис, Зак Шеер, Эмили Шули, Мониша Б. Шварц, Крис Скьякко, Стивен Шаффер, Джейсон Шумэйкер, Обри Линеа Шор, Барак Шипиз, Саад Сиддикуи, Майкл К. Сигл, Гари Зиверс, Аарон Смит, Эрик Смит, Колин Снайдер, Кен Спассионе, Стивен Ти Стэнтон, Блейк Штейгерволд, , Франц Страссманн, Том Стразерс, , Кевин Тански, Сами Тесфай, Мэттью Зане, , , Гуалберто Дель Торо, ТайЛин Полли, , Томас Тулл, Джей Тирофф, Крэйг Усьяк, Крис Вайна, Грасиела Вальдеррама, Андреа Василиу, Мишель Веззани, Крис Виктор, Барбара Винсент, Майк Уоллес, Мин Ван, Хайнс Уорд, Майкл О. Уоткинс, Кристофер Уоттс, Грэйг Ф. Вейч, Джеймс Верли, Лоуренс Витенер, Николас Вигэнд, , Джастин Майкл Вудс, Джейсон Йи, Митчелл Йи, Николай Еремин, Мария Замбрана, Билли Чжао, Дэвид Т Зиммерман, Джон Зион, Алекс Зивак, Рафаэль Субисаррета мл."
688,Гарри Поттер и Тайная комната,8.1,2002,161,"США, Великобритания","приключения, фэнтези, семейный","Домашний эльф, магический дневник и привидение. Второй год Гарри в школе Хогвартс — еще более захватывающий",Крис Коламбус,"Дэниэл Рэдклифф, Руперт Гринт, Эмма Уотсон, Том Фелтон, Кеннет Брана, Бонни Райт, Алан Рикман, Ричард Харрис, Мэгги Смит, Робби Колтрейн, Мэттью Льюис, Джейсон Айзекс, Джули Уолтерс, Марк Уильямс, Джеймс Фелпс, Оливер Фелпс, Ричард Гриффитс, Фиона Шоу, Гарри Меллинг, Дэвид Брэдли, Хью Митчелл, Шон Биггерстаф, Мириам Маргулис, Тоби Джонс, Джим Нортон, Вероника Клиффорд, Крис Рэнкин, Эдвард Тудор-Поул, Дженни Тэррен, Том Найт, Хезер Блисдэйл, Изабелла Коламбус, Питер О’Фэррелл, Бен Боровецки, Гарри Тейлор, Девон Мюрэй, Джейми Уэйлетт, Джошуа Хердман, Джемма Пэдли, Джон Клиз, Альфред Энок, Элинор Коламбус, Рошелль Дуглас, Эмили Дэйл, Даниэль Табор, Джейми Йетс, Уорвик Дэвис, Виолет Коламбус, Питер Тейлор, Люк Янблад, Скотт Фирн, Дэвид Холмс, Дэвид Мэссам, Тони Кристиан, Дэвид Черчард, Джемма Джонс, Ширли Хендерсон, Эдвард Рэнделл, Салли Мортемор, Луис Дойл, Шарлотта Скеч, Брендан Коламбус, Роберт Эйрс, Альфред Бёрк, Лесли Филлипс, Хелен Стюарт, Дэйзи Бейтс, Дэвид Тайсолл, Кристиан Коулсон, Мартин Бэйфилд, Роберт Харди, Джулиан Гловер, Лес Бабб, , Пол Бэннон, Пол Бейтман, Масео Бхардвай, , , , Шон Кронин, Декстер, Эми Пулья, , Сало Гарднер, , Виктория Годдар, Антония Хэмптон, , , , , Роуз Доун, Памела Кемпторн, Оливер Левери-Фараг, , Лили Ловетт, Нэйтан Лаббок-Смит, Иэн Мэден, Теренс МакОли, , , Кристофер О’Ши, , , Петя Павлова, , , Эдриан Роулинз, , , Джесс Смит, Джеральдин Сомервилль, , тройняшки Саундерс, , Нина Янг"
44745,"Кавказская пленница, или Новые приключения Шурика",8.5,1966,82,СССР,"мелодрама, приключения, комедия, мюзикл",Отважный Шурик бросается спасать красавицу Нину из лап похитителей. Добродушная советская комедия,Леонид Гайдай,"Александр Демьяненко, Наталья Варлей, Юрий Никулин, Георгий Вицин, Евгений Моргунов, Владимир Этуш, Фрунзик Мкртчян, Руслан Ахметов, Нина Гребешкова, Михаил Глузский, Георгий Милляр, Эммануил Геллер, Пётр Репнин, Ной Авалиани, Донара Мкртчян, Алексей Строев, Аида Ведищева, Михаил Содорский, Богдан Галустян, Георгий Светлани, Олег Севостьянов, Леонид Довлатов, Гусейн Ахундов, Владислав Лынковский, Шота Харабадзе, Николай Гаро"
