FilmId,Title,Rating,Year,Duration,Countries,Genres,ShortDescription,Director,Actors
408876,Хоббит: Пустошь Смауга,8.0,2013,161,"США, Новая Зеландия","приключения, боевик, фэнтези","Бильбо и гномы все ближе к Одинокой горе, где их ждет дракон Смауг. Возвращение Орландо Блума к роли Леголаса",Питер Джексон,"Мартин Фриман, Ричард Армитедж, Иэн Маккеллен, Эванджелин Лилли, Орландо Блум, Люк Эванс, Бенедикт Камбербэтч, Ли Пейс, Кен Стотт, Эйдан Тёрнер, Грэм Мактавиш, Джеймс Несбитт, Джон Коллен, Питер Хэмблтон, Джед Брофи, Уильям Кирчер, Стивен Хантер, Дин О’Горман, Марк Хэдлоу, Адам Браун, Сильвестр МакКой, Стивен Фрай, Ману Беннетт, Лоуренс Макор, Кейт Бланшетт, Микаэл Персбрандт, Райан Гейдж, Джон Белл, Пегги Несбитт, Мэри Несбитт, Бен Митчелл, Стефан Уре, Крэйг Холл, Робин Керр, Эли Кент, Саймон Лондон, Брайан Серджент, Питер Вере-Джонс, Марк Митчинсон, Келли Килгур, Сара Пирс, Ник Блейк, Даллас Барнетт, Мэтт Смит, Кэти Джексон, Ричард Уайтсайд, Грег Эллис, Рэй Хенвуд, Тим Гордон, Джабез Олссен, Стивен Колбер, Эвелин МакГи, Питер Колбер, Джон Колбер, Норман Кали, Картер Никсон, Зейн Уэйнер, Аллан Смит, Фрейзер Андерсон, , Марк Аткин, , , Родни Бэйн, , , Кори Бистон, , Вивьен Белл, , , Дороти Энн Боннер, Шэйн Болтон, Райли Брофи, , , , , , , Розали ван Хорик, , , , , , , , Дэвид Дональдсон, , , Фрэнк Эдвардс, , , Фиби Гиттинс, Стивен Грэй, , Джэми Харрисон, , , Кэтрин Бриггс Хоббс, Джон Хоу, Мартин Хауэллс, Алекс Исикава, Питер Джексон, , Изабель Роуз Кирхер, , Алан Ли, , , , , , Лиз Мертон, , Джозеф Мика-Хант, , , Терри Нотари, Уэсли О’Дьюинн, Стивен О’Нилл, , , , , , Дэниэл Расбон, , Стив Рош, , Уорвик Сэдлер, , Эд Ширан, Энтони Шер, Тим Симпсон, Марко Синигалья, Джефф Слейвен, Дайян Смит, , Стэн, Джеффри Томас, Ройд Толкин, Марк Троттер, Мануэла Веттерс, , , Кристофер Уинчестер, , Мин Виндл, "
41381,В августе 44-го,8.0,2001,118,"Россия, Беларусь","триллер, драма, детектив, боевик, военный",Опергруппа капитана Алехина устраивает засаду на немецких агентов. Военный фильм с отличным актерским составом,Михаил Пташук,"Евгений Миронов, Владислав Галкин, Юрий Колокольников, Беата Тышкевич, Алексей Петренко, Александр Феклистов, Рамаз Чхиквадзе, Александр Балуев, Ярослав Бойко, Анджей Печиньски, Каролина Грушка, Радослав Пазура, Владимир Семаго, Виктор Павлов, Александр Лабуш, Алексей Панин, Юрий Пристром, Константин Соловьев, Расми Джабраилов, Анатолий Кот, Геннадий Давыдько, Николай Кириченко, Виктор Манаев, Александр Тимошкин, Петр Юрченков ст., Анна Казючиц, Александр Ефимов, Николай Рябычин, Александр Молчанов, Альберт Филозов, Юрий Цурило, Иван Лешук, Александр Брухацкий, Александр Суцковер, Алексей Макаров, Валентина Петрачкова, Полина Ганшина, Татьяна Говорова, Сергей Мамаев, Александр Овчинников, Игорь Подливальчев, Арнольд Помазан, Анжела Пташук, Николай Раевский, Сергей Кравец, Владимир Пузыня, Сергей Шарангович"
382,Американская история X,8.3,1998,119,США,драма,Экс-нацист пытается вытащить брата из группировки скинхедов. Знаковая антирасистская драма с Эдвардом Нортоном,Тони Кэй,"Эдвард Нортон, Эдвард Ферлонг, Беверли Д’Анджело, Дженнифер Лиен, Итан Сапли, Файруза Балк, Эйвери Брукс, Эллиотт Гулд, Стейси Кич, Уильям Расс, Гай Торри, Джо Кортезе, Джейсон Боуз Смит, Антонио Дэвид Лайонс, Алекс Сол, Керам Малики-Санчес, Джузеппе Эндрюс, Мишель Кристин Уайт, Джонатан Фаулер мл., Кристофер Мастерсон, Николас Р. Олесон, Джордан Мардер, Пол Ле Мэт, Томас Л. Беллиссимо, Чериш Ли, Сэм Влахос, Тара Бланчард, Энн Лэмтон, Стив Вулфорд, Ричард Нойс, Дансо Гордон, Джим Нортон, Давид Базалто, Алексис Роуз Коэн, Кианте Элам, Пол Хопкинс, Кит Одетт, Пол Э. Шорт, Найджел Мигель, Даррел Бритт, Роберт «Даки» Карпентер, Сидни «Биг Дог» Колстон, Ханс Коззенс, Джон Эмери, Максимиллиан Кесмодел, Барби Мари, Андре МакКой, Элли Мосс, Денни Пирс, Глендон Рич, Луис Э. Росас, Сэм Сарпонг, Марк Суонсон, Джереми Свит, Селвин Уорд, Дебра Уилсон"
325381,Вверх,8.0,2009,96,США,"драма, приключения, комедия, мультфильм, семейный","78-летний ворчун отправляется в полет на воздушных шарах. Шедевр Pixar о том, как важно следовать за мечтой",Боб Питерсон,"Эдвард Эснер, Кристофер Пламмер, Джордан Нагаи, Боб Питерсон, Делрой Линдо, Джером Рэнфт, Джон Ратценбергер, Дэвид Кэй, Эли Доктер, Джереми Лири, Микки Макгоун, Дэнни Манн, Дональд Фуллилав, Джесс Харнелл, Джош Кули, Пит Доктер, Марк Эндрюс, Боб Берген, Бренда Чепмен, Эмма Коутс, Джон Сайган, Пол Айдинг, Тони Фучиле, Тереза Ганзел, Шерри Линн, Лорейн Ньюмен, Тедди Ньютон, Джефф Пиджон, Валери ЛаПойнт, Жан Рэбсон, Боб Скотт, Мурат Сен, Джек Эйнджел, Грег Берг, Себастиан Вархольм, Гарри Ширер, Роджер Бампасс, Дженнифер Дарлинг, Деби Дерриберри, Билл Фармер, Пэт Фрай, Мистер Лоуренс, Джули Лемье, Мона Маршалл, Райан О’Донохью, Роб Полсен, Патрик Пинни, Филип Проктор, Фред Таташиор, Джим Уорд"
77283,Тот самый Мюнхгаузен,8.3,1979,134,СССР,"драма, фэнтези, комедия",Общество против чудака и пророка. Одна из лучших ролей Олега Янковского в знаковой трагикомедии Марка Захарова,Марк Захаров,"Олег Янковский, Инна Чурикова, Елена Коренева, Игорь Кваша, Александр Абдулов, Леонид Ярмольник, Юрий Катин-Ярцев, Владимир Долинский, Леонид Броневой, Семен Фарада, Всеволод Ларионов, Арсен Амаслюрянц, А. Мюльштедт, Г. Ошколуп, Нина Палладина, К. Ю. Стейман, Владимир Яновскис, Игорь Ясулович, Вадим Александров, Е. Винтцен, Григорий Маликов, Юрий Мартынов, К. Нитц, Любовь Полищук, Анатолий Скорякин, М. Хохарина, Сергей Торкачевский, Владимир Фирсов, Евгений Марков, Владимир Ванышев, Олег Соколов, Арсен Амаспюрянц"
592260,Эрнест и Селестина: Приключения мышки и медведя,8.1,2012,80,"Франция, Люксембург, Бельгия","драма, криминал, приключения, фэнтези, комедия, мультфильм, семейный",Бесстрашную мышку и голодного медведя связала необычная дружба. Нежный акварельный мультфильм по книжной серии,Бенжамин Реннер,"Ламбер Вильсон, Полин Брюннер, Энн-Мари Луп, Патрис Меленнек, Брижитт Виртюд, Леонар Луф, Доминик Морен, Перретт Прадье, Ян Лемадик, Федор Аткин, Пьер Батон, Винсент Грасс, Патрис Дозье, Жак Сирон, Геренс Повель, Максим Бейёль, , Янис Бельхадж, , , , Самюэль Каю, Аделин Шетель, , Мишель Элиас, , , Натали Хаят, , Паскаль Жакмон, Гвенаэль Жегу, , Эммануэль Лемир, Арно Леонар, , , Коринн Мартен, Майте Монсо, Оливия Никозия, , Оливье Подеста, , Томас Саголс, , Корали Тюлье, Лорен Бэколл, , Дельфина Белль, Сьюзан Блэйксли, Дэвид Боут, Эшли Боттчер, Эшли Брук, Марша Кларк, , Этан Луис Сэмюэлс ДиСальвио, Эшли Эрнест, Маккензи Фой, Пол Джаматти, Джо Ханна, Боб Джоулз, Гари Литман, Уильям Х. Мэйси, Хантер Маки, Меган Маллалли, Джо Охман, Ник Офферман, Стефани Ше, Майкл Синтерниклаас, Спайк Спенсер, , Форест Уитакер, Джеффри Райт"
645118,Головоломка,8.1,2015,95,США,"комедия, мультфильм, семейный",Пять человеческих эмоций должны договориться и помочь девочке справиться с собой. «Оскар» за лучший мультфильм,Роналдо Дель Кармен,"Эми Полер, Филлис Смит, Ричард Кайнд, Билл Хейдер, Льюис Блэк, Минди Кейлинг, Кейтлин Диас, Дайан Лэйн, Кайл МакЛоклен, Пола Паундстон, Бобби Мойнахан, Пола Пелл, Дэйв Гольц, Фрэнк Оз, Джош Кули, Фли, Джон Ратценбергер, Карлос Аласраки, Питер Сэгал, Рашида Джонс, Лори Алан, Грегг Бергер, Аврора Блу, Вероника Бонелл, , Джон Сайган, Дэни Даре, Андреа Датцман, Роналдо Дель Кармен, Пит Доктер, Кит Фергюсон, Тони Фучиле, Мэри Гиббс, , Картер Хатингс, Джейкоб Хопкинс, Эмма Худак, , Дара Ирука, Молли Джексон, Даниэлла Джонс, , Элисса Найт, Эрик Лэнгли, Доун Льюис, Шерри Линн, Тони Маки, Мона Маршалл, Лорейн Ньюмен, Брэт «Брук» Паркер, Ник Питера, Филип Проктор, , Патрик Сэйтц, Пэрис Ван Дайк, Джим Уорд, Леннон Винн, , Боб Берген, Джек Эйнджел, Бен Кокс, Роджер Бампасс, Тереза Ганзел, Джесс Харнелл, Дэнни Манн, Микки Макгоун, Жан Рэбсон, , Кристофер Рэглэнд"
395,Шестое чувство,8.2,1999,107,США,"триллер, драма, детектив, фантастика, фэнтези",Детский психолог открывает жуткую тайну маленького пациента. Грандиозная мистическая драма с Брюсом Уиллисом,М. Найт Шьямалан,"Брюс Уиллис, Хэйли Джоэл Осмент, Тони Коллетт, Оливия Уильямс, Тревор Морган, Донни Уолберг, Питер Энтони Тамбакис, Джеффри Зубернис, Брюс Норрис, Гленн Фицджералд, Грег Вуд, Миша Бартон, Анджелика Торн, Лиза Саммерур, Фирдус Бамжи, Самия Шоаб, Хейден Сонье, Дженис Дардарис, Нилл Хартли, Сара Рипард, Хайди Фишер, КаДи Стрикленд, Майкл Дж. Лайонс, Саманта Фицпатрик, Холли Радкин, Кейт Кирни-Патч, Мэрлин Шанок, М. Найт Шьямалан, Уэс Хейвуд, Нико Вулард, Кэрол Нилсон, Кит Вулард, Джоди Доусон, Тони Майкл Доннелли, Ронни Лиа, Карлос Ксавьер Лопез, Джино Инверсо, Эллен Шеппард, Том МакЛафлин, Кэнди Астон-Деннис, Патрик МакДэйд, Хосе Л. Родригез, Джина Аллегро, Боб Бауэрсокс, , Мэтт Касале, Ким Коэн, Марк Фальво, , Джефри Брайан Холмс, , Коллин Джун МакКуайд, Джонатан Нейшн, Шон Оливер, Элисон Робертсон, "
46068,Белый Бим Черное ухо,8.4,1976,183,СССР,драма,"Верный пес вопреки всему ждет возвращения хозяина из больницы. Советский «Хатико», номинированный на «Оскар»",Станислав Ростоцкий,"Вячеслав Тихонов, Валентина Владимирова, Михаил Дадыко, Иван Рыжов, Ирина Шевчук, Михаил Зимин, Геннадий Кочкожаров, Римма Мануковская, Мария Скворцова, Анатолий Баранцев, Виталий Леонов, Никита Астахов, Любовь Соколова, Алексей Чернов, Раиса Рязанова, Георгий Светлани, Анна Рыбникова, Василий Воробьев, Сергей Шевляков, Светлана Харитонова, Алексей Миронов, Родион Александров, Юрий Хржановский, Андрей Мартынов, Владимир Сергиенко, Виталий Пономарев, Владимир Разумовский, Дмитрий Барков, Слава Цюпа, Иван Жеваго, Бронислава Захарова, Федор Корчагин, Николай Погодин, Федор Екатериничев, Галина Комарова, Алейсей Миранов, Татьяна Никитина, Валерий Хромушкин, Зоя Толбузина"
843649,Мстители: Война бесконечности,8.0,2018,149,США,"фантастика, приключения, боевик",Титан Танос вынашивает страшный план — угрозу всей Вселенной. Предпоследний фильм о суперкоманде Marvel,Джо Руссо,"Роберт Дауни мл., Крис Хемсворт, Марк Руффало, Крис Эванс, Скарлетт Йоханссон, Дон Чидл, Бенедикт Камбербэтч, Том Холланд, Чедвик Боузман, Зои Салдана, Карен Гиллан, Том Хиддлстон, Пол Беттани, Элизабет Олсен, Энтони Маки, Себастиан Стэн, Идрис Эльба, Данай Гурира, Питер Динклэйдж, Бенедикт Вонг, Пом Клементьефф, Дэйв Батиста, Вин Дизель, Брэдли Купер, Гвинет Пэлтроу, Бенисио Дель Торо, Джош Бролин, Крис Пратт, Шон Ганн, Уильям Хёрт, Летишиа Райт, Терри Нотари, Том Вон-Лолор, Кэрри Кун, Майкл Джеймс Шоу, Стэн Ли, Уинстон Дьюк, Флоренс Касумба, Керри Кондон, Моник Гэндертон, Джейкоб Баталон, Тиффани Эспенсен, Изабелла Амара, Этан Дизон, Ариана Гринблатт, Амина Каплан, Росс Маркванд, Майкл Энтони Роджерс, Стивен МакФили, Аарон Лазар, Роберт Пралго, , Блэр Ясин, Мэттью Зук, Лаура Миллер, Мария Джульетт Эбни, Джанешиа Адамс-Гиньяр, Джордж Александр, , Кеннет Брана, Серджо Брионес, , Джондэйс Кэндес, Донни Керрингтон, Люси Кэрролл, Жамель Чэмберс, Мэттью Кристенсен, , Кит Дэвис, , Тони Дюпар, Джаззи Эллис, Дэвид Эскобар, , Джейкоб Эванс, , , , Матавиоус Гейлс, Джон Геттье, , , Соломон Глэйв, Эмелита Т. Гонсалес, Дэниэл Грэхэм, Карлос Гуити, , Сесил М. Генри, Бобби Хоскинс, Рэбон Хатчерсон, Сэмюэл Л. Джексон, Бобби Джеймс, , Прешес Дженкинс, Флойд Энтони Джонс мл., Мэллори Кидвелл, Девин Колер, Деметри Лэнделл, , Эльгин Ли, , , Маркус Льюис, Люк Мехер, , Тим МакАдамс, Эндрю С. МакМиллан, Перла Миддлтон, Майкл П. Миллер, , Кевин Монтгомери, , Джаред Мосер, Мари Мурум, , , Харрисон Остерфилд, Эдвард Паркер, , Натаниэл Перри, Халиль Ла’Марр Пикетт, Энни Писапья, Тарайя Рамсесс, Антхуан Рэймс, Райан Робертсон, , Джереми Сэмпл, Брэндон М. Шоу, , Джеймс Сидериц, Мэттью Эксел Симмонс, Джозеф Синглтери, Доминик Смит, Коби Смолдерс, Шон Соут, Джеймс Стерлинг, Дженел Стивенс, , Федра Синдл, Хамид-Реза Бенжамин Томпсон, Роберт Тинсли, Трэвис Томпсон, , Таня Уилок, Зола Уильямс, Кевин Ди Уилсон, Майкл Дэвид Юл"
8221,Мой сосед Тоторо,8.2,1988,86,Япония,"приключения, фэнтези, мультфильм, семейный, аниме",Сестренки знакомятся с обаятельным духом леса. История о вере в чудо стала визитной карточкой студии Ghibli,Хаяо Миядзаки,"Норико Хидака, Тика Сакамото, Хитоси Такаги, Таниэ Китабаяси, Суми Симамото, Сигэсато Итои, Тосиюки Амагаса, Масаси Хиросэ, Юко Маруяма, Юко Мидзутани, Даики Накамура, Томохиро Нисимура, Рэйко Судзуки, Сигэру Тиба, Наоки Тацута, Матико Васио, Ивэн Сабара, Тиэ Кодзиро, Тарако, Мицуко Исида, Акико Хирамацу, Икуэ Отани"
12198,Игра,8.3,1997,129,США,"триллер, драма, детектив, приключения","Жизнь банкира превращается в ад, но, возможно, это кем-то спланировано. Хищный и едкий триллер Дэвида Финчера",Дэвид Финчер,"Майкл Дуглас, Шон Пенн, Дебора Кара Ангер, Джеймс Ребхорн, Питер Донат, Кэррол Бейкер, Анна Катарина, Армин Мюллер-Шталь, Чарльз Мартине, Скотт Хантер МакГуайр, Флорентин Макану, Элизабет Деннехи, Кэролин Барклай, Дэниэл Шорр, Джон Эпри, Харрисон Янг, Кимберли Расселл, Джо Фрэнк, Джеймс Брукс, Джерри Бекер, Джерион Монро, Томми Флэнаган, Билл Флэннери, Кэт Килкенни, Джон Кассини, Харрис Савидис, Аарон Лукич, Виктор Толмедж, Марк Сиглер, Андре Бразо, Кеена Тернер, Карлос Хой, , Шон Лантье, Кертис Вантерпул, Джей Гордон, Джеффри Майкл Янг, Оуэн Мастерсон, Юдзи Окумото, Хидео Кимура, Рэйчел Флэнаган, Марк Бун мл., Джой Энн Райан, Питер Давидьян, Джек Кихоу, Кристофер Джон Филдс, Линда Мэнз, Виктор Феррерира, Даффи Гейвер, Боб Стивенсон, Шон Молони, Джон Хэммил, Рэйчел Стейнберг, Джордж Магуайр, Триш Саммервилл, Джейсон Кристофер, Лили Соу Фрохлих, Тэмми Колер, Майкл Линвуд, Алекс Линвуд, Чарльз Брэнклин, Спайк Джонс, Майкл Масси, Сара Даваллу, Стивен Коуи, Джипси Бутс, Кристофер Кори, Том Кроул, , Боб Дини, Теренс Форд, Уилл Джонс, Анни Лонг, Трейси Мэй, Джэми Миджли, Дж. Энтони Пена, Боб Куинн, Элиз Робинс, Боб Скотт, Джейсон Усон"
81733,Гордость и предубеждение,8.0,2005,129,"США, Франция, Великобритания","драма, мелодрама","Сестры Беннет ищут любовь, статус и себя в Англии XVIII века. Образцовая адаптация главного романа Джейн Остин",Джо Райт,"Кира Найтли, Мэттью Макфэдиен, Розамунд Пайк, Саймон Вудс, Дональд Сазерленд, Бренда Блетин, Джена Мэлоун, Кэри Маллиган, Талула Райли, Том Холландер, Келли Райлли, Джуди Денч, Клоди Блейкли, Сильвестр Моранд, Пип Торренс, Джанет Уайтсайд, Шинед Мэтьюз, Рой Холдер, Руперт Френд, Джей Симпсон, Розамунд Стивен, Саманта Блум, Корнелиус Бут, Пенелопа Уилтон, Питер Уайт, Мэг Винн Оуэн, Тэмзин Мёрчант, Мойя Брэди, Марк Арендс, Билли Берк, Кейт Коуплэнд, Стефен Хамби, Брэт Джонс, Арнольд Монти, Лайам Томас"
